{
  "schemaVersion": 1,
  "family": "E",
  "familyName": "templates",
  "generator": "scripts/render-reference.mjs",
  "members": [
    {
      "name": "cargo/Cargo.lints.toml",
      "kind": "template",
      "shipsTo": {
        "tier": "framework",
        "stacks": [
          "cargo"
        ]
      },
      "description": "Clippy severity projection rendered by the cargo backend (render-clippy.ts): promotes the clippy.toml bans to the deny surface — without it a banned call is only a WARNING and `cargo clippy` exits 0.",
      "source": {
        "path": "packages/core/templates/templates.manifest.json",
        "line": 3
      },
      "installedTo": [
        {
          "stack": "cargo",
          "lane": "brownfield-clippy",
          "path": ".getff/Cargo.lints.toml"
        },
        {
          "stack": "cargo",
          "lane": "greenfield",
          "path": ".getff/Cargo.lints.toml"
        }
      ],
      "extras": {
        "format": "toml"
      },
      "example": null
    },
    {
      "name": "cargo/clippy.toml",
      "kind": "template",
      "shipsTo": {
        "tier": "framework",
        "stacks": [
          "cargo"
        ]
      },
      "description": "Clippy disallowed-methods/types bans for the cargo stack (the enforced lane); severity projection lives in Cargo.lints.toml.",
      "source": {
        "path": "packages/core/templates/templates.manifest.json",
        "line": 7
      },
      "installedTo": [
        {
          "stack": "cargo",
          "lane": "greenfield",
          "path": "clippy.toml"
        },
        {
          "stack": "cargo",
          "lane": "brownfield-clippy",
          "path": "getff-clippy.toml"
        }
      ],
      "extras": {
        "format": "toml"
      },
      "example": null
    },
    {
      "name": "cargo/deny.toml",
      "kind": "template",
      "shipsTo": {
        "tier": "framework",
        "stacks": [
          "cargo"
        ]
      },
      "description": "cargo-deny config for dependency-level bans clippy cannot express (ecosystem-wiring W4); ships as a starter config no workflow runs.",
      "source": {
        "path": "packages/core/templates/templates.manifest.json",
        "line": 11
      },
      "installedTo": [
        {
          "stack": "cargo",
          "lane": "brownfield-clippy",
          "path": "deny.toml"
        },
        {
          "stack": "cargo",
          "lane": "greenfield",
          "path": "deny.toml"
        }
      ],
      "extras": {
        "format": "toml"
      },
      "example": null
    },
    {
      "name": "cargo/github-actions-ci.yml",
      "kind": "template",
      "shipsTo": {
        "tier": "framework",
        "stacks": [
          "cargo"
        ]
      },
      "description": "GitHub Actions CI for the cargo stack — runs cargo clippy with the bans CI-failing when violated.",
      "source": {
        "path": "packages/core/templates/templates.manifest.json",
        "line": 15
      },
      "installedTo": [
        {
          "stack": "cargo",
          "lane": "brownfield-clippy",
          "path": ".github/workflows/getff-cargo.yml"
        },
        {
          "stack": "cargo",
          "lane": "greenfield",
          "path": ".github/workflows/getff-cargo.yml"
        }
      ],
      "extras": {
        "format": "yml"
      },
      "example": null
    },
    {
      "name": "go/.golangci.yml",
      "kind": "template",
      "shipsTo": {
        "tier": "framework",
        "stacks": [
          "go"
        ]
      },
      "description": "golangci-lint config for the go stack; inert until the operator opts in (rule generation deferred).",
      "source": {
        "path": "packages/core/templates/templates.manifest.json",
        "line": 19
      },
      "installedTo": [
        {
          "stack": "go",
          "lane": "greenfield",
          "path": ".golangci.yml"
        },
        {
          "stack": "go",
          "lane": "brownfield-golangci",
          "path": "getff-golangci.yml"
        }
      ],
      "extras": {
        "format": "yml"
      },
      "example": null
    },
    {
      "name": "go/github-actions-ci.yml",
      "kind": "template",
      "shipsTo": {
        "tier": "framework",
        "stacks": [
          "go"
        ]
      },
      "description": "GitHub Actions CI for the go stack — runs the getff golangci-lint ban surface (adapter-jig J3).",
      "source": {
        "path": "packages/core/templates/templates.manifest.json",
        "line": 23
      },
      "installedTo": [
        {
          "stack": "go",
          "lane": "brownfield-golangci",
          "path": ".github/workflows/getff-go.yml"
        },
        {
          "stack": "go",
          "lane": "greenfield",
          "path": ".github/workflows/getff-go.yml"
        }
      ],
      "extras": {
        "format": "yml"
      },
      "example": null
    },
    {
      "name": "python/.getff/astgrep-rules/getff-no-datetime-datetime-now.yml",
      "kind": "template",
      "shipsTo": {
        "tier": "framework",
        "stacks": [
          "python"
        ]
      },
      "description": "ast-grep rule banning the `datetime.datetime.now` form (timezone-naive now) on the python lane.",
      "source": {
        "path": "packages/core/templates/templates.manifest.json",
        "line": 27
      },
      "installedTo": [
        {
          "stack": "python",
          "lane": "brownfield-ruff",
          "path": ".getff/astgrep-rules/getff-no-datetime-datetime-now.yml"
        },
        {
          "stack": "python",
          "lane": "brownfield-sgconfig",
          "path": ".getff/astgrep-rules/getff-no-datetime-datetime-now.yml"
        },
        {
          "stack": "python",
          "lane": "greenfield",
          "path": ".getff/astgrep-rules/getff-no-datetime-datetime-now.yml"
        }
      ],
      "extras": {
        "format": "yml"
      },
      "example": null
    },
    {
      "name": "python/.getff/astgrep-rules/getff-no-datetime-now.yml",
      "kind": "template",
      "shipsTo": {
        "tier": "framework",
        "stacks": [
          "python"
        ]
      },
      "description": "ast-grep rule banning the `datetime.now` form (timezone-naive now) on the python lane.",
      "source": {
        "path": "packages/core/templates/templates.manifest.json",
        "line": 31
      },
      "installedTo": [
        {
          "stack": "python",
          "lane": "brownfield-ruff",
          "path": ".getff/astgrep-rules/getff-no-datetime-now.yml"
        },
        {
          "stack": "python",
          "lane": "brownfield-sgconfig",
          "path": ".getff/astgrep-rules/getff-no-datetime-now.yml"
        },
        {
          "stack": "python",
          "lane": "greenfield",
          "path": ".getff/astgrep-rules/getff-no-datetime-now.yml"
        }
      ],
      "extras": {
        "format": "yml"
      },
      "example": null
    },
    {
      "name": "python/.getff/astgrep-rules/getff-no-eval.yml",
      "kind": "template",
      "shipsTo": {
        "tier": "framework",
        "stacks": [
          "python"
        ]
      },
      "description": "ast-grep rule banning `eval` on the python lane.",
      "source": {
        "path": "packages/core/templates/templates.manifest.json",
        "line": 35
      },
      "installedTo": [
        {
          "stack": "python",
          "lane": "brownfield-ruff",
          "path": ".getff/astgrep-rules/getff-no-eval.yml"
        },
        {
          "stack": "python",
          "lane": "brownfield-sgconfig",
          "path": ".getff/astgrep-rules/getff-no-eval.yml"
        },
        {
          "stack": "python",
          "lane": "greenfield",
          "path": ".getff/astgrep-rules/getff-no-eval.yml"
        }
      ],
      "extras": {
        "format": "yml"
      },
      "example": null
    },
    {
      "name": "python/.getff/astgrep-rules/getff-no-os-system.yml",
      "kind": "template",
      "shipsTo": {
        "tier": "framework",
        "stacks": [
          "python"
        ]
      },
      "description": "ast-grep rule banning `os.system` shell-outs on the python lane.",
      "source": {
        "path": "packages/core/templates/templates.manifest.json",
        "line": 39
      },
      "installedTo": [
        {
          "stack": "python",
          "lane": "brownfield-ruff",
          "path": ".getff/astgrep-rules/getff-no-os-system.yml"
        },
        {
          "stack": "python",
          "lane": "brownfield-sgconfig",
          "path": ".getff/astgrep-rules/getff-no-os-system.yml"
        },
        {
          "stack": "python",
          "lane": "greenfield",
          "path": ".getff/astgrep-rules/getff-no-os-system.yml"
        }
      ],
      "extras": {
        "format": "yml"
      },
      "example": null
    },
    {
      "name": "python/ARCHITECTURE.md",
      "kind": "template",
      "shipsTo": {
        "tier": "framework",
        "stacks": [
          "python"
        ]
      },
      "description": "Architecture doc rendered into python-stack consumer repos — layer rules and dependency direction.",
      "source": {
        "path": "packages/core/templates/templates.manifest.json",
        "line": 43
      },
      "installedTo": [
        {
          "stack": "python",
          "lane": "brownfield-ruff",
          "path": ".ai-factory/ARCHITECTURE.python.md"
        },
        {
          "stack": "python",
          "lane": "brownfield-sgconfig",
          "path": ".ai-factory/ARCHITECTURE.python.md"
        },
        {
          "stack": "python",
          "lane": "greenfield",
          "path": ".ai-factory/ARCHITECTURE.python.md"
        }
      ],
      "extras": {
        "format": "md"
      },
      "example": null
    },
    {
      "name": "python/RULES.md",
      "kind": "template",
      "shipsTo": {
        "tier": "framework",
        "absent": "no-lane"
      },